concept,representation,library,inspection_target,check
isometric group action,group,networkx,Locate how isometric group action controls the unit invariant.,final-sanity.json
fundamental domain,group,matplotlib,Locate how fundamental domain controls the unit invariant.,final-sanity.json
quasi-isometry,group,numpy,Locate how quasi-isometry controls the unit invariant.,final-sanity.json
ends of a space,group,networkx,Locate how ends of a space controls the unit invariant.,final-sanity.json
growth type,group,matplotlib,Locate how growth type controls the unit invariant.,final-sanity.json
