concept,representation,library,why,artifact
CW skeleta and characteristic maps,incidence graph plus exact boundary matrices,"NetworkX, Matplotlib, SymPy","the proof data is combinatorial, while boundary^2 is exact algebra",figures/cw-skeleton-characteristic-maps.png
epsilon neighborhoods and deformation retracts,interactive radial collar retraction,"Plotly, NumPy",a slider exposes the time parameter without hiding the radial formula,html/neighborhood-deformation-retract.html
product CW topology and Dowker wedge behavior,constructive neighborhood-hit witness,"Plotly, NumPy",the issue is a limiting product-neighborhood phenomenon,html/product-cw-dowker-counterexample.html
ENRs and local contractibility,cubical neighborhood and retract arrows,"Matplotlib, NumPy",the theorem is geometric in Euclidean neighborhoods,figures/enr-cubical-neighborhood-retract.png
compact-open topology and exponential law,path tubes plus currying/evaluation diagram,"Plotly, NetworkX, SymPy",compact-open subbasis and exponential identities are map-space data,html/compact-open-path-neighborhoods.html
