concept,library,artifact,check
endpoint-fixed homotopy,Plotly + NumPy,html/path-homotopy-and-product.html,endpoints remain fixed
basepoint change,NetworkX + Matplotlib,figures/basepoint-change-conjugation.png,conjugation is a homomorphism
circle winding,Plotly + NumPy,html/circle-lift-winding.html,lift endpoint equals winding number
van Kampen,NetworkX + SymPy,figures/van-kampen-cover-nerve.png,overlap relators enter a normal quotient
covering monodromy,NetworkX + permutations,figures/monodromy-permutations.png,orbits and deck centralizers agree
