concept,representation,library,inspection_target,check
convex distance function,projection,matplotlib,Locate how convex distance function controls the unit invariant.,final-sanity.json
closed convex projection,projection,numpy,Locate how closed convex projection controls the unit invariant.,final-sanity.json
circumcenter,projection,scipy,Locate how circumcenter controls the unit invariant.,final-sanity.json
flat subspace,projection,matplotlib,Locate how flat subspace controls the unit invariant.,final-sanity.json
metric midpoint inequality,projection,numpy,Locate how metric midpoint inequality controls the unit invariant.,final-sanity.json
