concept,representation,library,inspection_target,check
Klein model,hyperbolic,matplotlib,Locate how Klein model controls the unit invariant.,final-sanity.json
Poincare ball,hyperbolic,plotly,Locate how Poincare ball controls the unit invariant.,final-sanity.json
half-space model,hyperbolic,numpy,Locate how half-space model controls the unit invariant.,final-sanity.json
Mobius action,hyperbolic,matplotlib,Locate how Mobius action controls the unit invariant.,final-sanity.json
hyperbolic isometry,hyperbolic,plotly,Locate how hyperbolic isometry controls the unit invariant.,final-sanity.json
