concept,representation,library,inspection_target,check
combinatorial 2-complex,group,networkx,Locate how combinatorial 2-complex controls the unit invariant.,final-sanity.json
attaching word,group,matplotlib,Locate how attaching word controls the unit invariant.,final-sanity.json
presentation complex,group,numpy,Locate how presentation complex controls the unit invariant.,final-sanity.json
cellular path,group,networkx,Locate how cellular path controls the unit invariant.,final-sanity.json
relation loop,group,matplotlib,Locate how relation loop controls the unit invariant.,final-sanity.json
