concept,representation,library,inspection_target,check
delta-slim triangle,hyperbolic,matplotlib,Locate how delta-slim triangle controls the unit invariant.,final-sanity.json
quasi-geodesic stability,hyperbolic,networkx,Locate how quasi-geodesic stability controls the unit invariant.,final-sanity.json
linear isoperimetric inequality,hyperbolic,numpy,Locate how linear isoperimetric inequality controls the unit invariant.,final-sanity.json
Gromov boundary,hyperbolic,matplotlib,Locate how Gromov boundary controls the unit invariant.,final-sanity.json
visual metric,hyperbolic,networkx,Locate how visual metric controls the unit invariant.,final-sanity.json
