candidate,hausdorff,second_countable,fixed_local_dimension,smooth_compatible,boundary_model,verdict
open interval in R,True,True,True,True,none,smooth 1-manifold
circle S1,True,True,True,True,none,smooth 1-manifold
closed half-plane H2,True,True,True,True,has boundary,smooth 2-manifold with boundary
line union isolated plane point,True,True,False,False,none,not a manifold: mixed local dimension
line with two origins,False,True,True,False,none,not a manifold under Lee's hypotheses
standard R plus cube chart together,True,True,True,False,none,not one smooth atlas without removing incompatibility
