concept,library,artifact,check
pseudosphere and negative curvature,Plotly,pseudosphere-negative-curvature.html,tractrix radius ledger
Poincare disk and inversive geodesics,Matplotlib + NumPy,poincare-half-plane-models.png,circle orthogonality residuals
"hyperboloid, Klein, Poincare projections",Matplotlib,hyperboloid-klein-poincare-projections.png,domain and radial-order ledger
distance and triangle computations,SymPy + NumPy,hyperbolic-distance-checks.json,Minkowski and law-of-cosines residuals
Hopf flow on the three-sphere,Plotly,hopf-flow-stereographic.html,finite stereographic fibers
