item,computational_object,check
weak derivative,test-function identity,source coverage includes weak solution and divergence-form rows
Sobolev norm,frequency-weighted coefficient sum,H^s partial energy growth matches the decay threshold
Calderon-Zygmund inequality,bounded Hessian multiplier,symbolic Hessian multiplier identity equals one
Laplace regularity,inverse-Laplace coefficient damping,k^2 u_hat recovers f_hat
elliptic bootstrapping,q/r exponent ladder,finite ladder reaches r > 2
weak-to-smooth upgrade,DAG of proof dependencies,directed acyclic graph with weak-to-smooth terminal node
