order,visual,concept,inspection_target,validation
1,figures/vector-fields-section-as-graph.png,smooth section X: M -> TM,the section condition is visible as base point plus tangent arrow,checks/vector-fields-section-as-graph.json
2,figures/coordinate-expression-rotation-field.png,coordinate expression,the same field can be checked exactly in two coordinate languages,checks/coordinate-expression-rotation-field.json
3,figures/vector-field-acts-on-function.png,vector field as derivation,directional differentiation is directly readable from level curves,checks/vector-field-acts-on-function.json
4,figures/pushforward-related-and-failure.png; html/pushforward-fold-failure.html,related fields and pushforwards,the target field must be single-valued over fibers,checks/pushforward-related-and-failure.json
5,figures/lie-bracket-coordinate-check.png,Lie bracket,the commutator is a new first-order field with exact coordinate checks,checks/lie-bracket-coordinate-checks.json
6,figures/affine-group-left-invariant-fields.png,Lie algebra of a Lie group,a two-dimensional nonabelian Lie group is visible as a half-plane,checks/affine-group-left-invariant-fields.json
