amount,budget_item,interpretation,unit
25660800,immediate-style geometry upload,host resends every instance every frame,bytes over 600 frames
237528,retained VBO plus per-instance matrices,mesh stays resident; host updates transforms,bytes over 600 frames
3600,separate draw calls,one command per object per frame,draw calls
600,instanced draw calls,one command per mesh family per frame,draw calls
23460,candidate fragment work,before final depth winner is known,fragments in toy rasterizer
7440,extra overdraw work,shaded/tested candidates that did not become visible,fragments in toy rasterizer
