first_debug_view,likely_state_to_check,symptom
clear color and flat fragment shader,"context exists, shader linked, framebuffer bound, viewport nonzero",blank frame
attribute color or UV gradient,"VAO stride, offsets, component counts, index type",mesh explodes or colors scramble
normal shader,"normal matrix, winding/culling, light uniforms",lighting is black or inside-out
depth buffer grayscale,"depth range, clear depth, comparison function, projection near/far",object disappears behind another
UV as color and sampler test texture,"wrap mode, filtering, bound texture unit, coordinate range",texture smears or tiles unexpectedly
