artifact,chapter_concept,coordinate_model,invariant
artifacts/chapter-25-hyperbolic-geometry/figures/staging-ground-boundary-zones.png,absolute conic,"diag(1,1,-1)",sign classifies inside/boundary/outside
artifacts/chapter-25-hyperbolic-geometry/figures/klein-poincare-geodesic-dictionary.png,Klein geodesic,chord between ideal endpoints,mapped Poincare samples are collinear
artifacts/chapter-25-hyperbolic-geometry/figures/klein-poincare-geodesic-dictionary.png,Poincare geodesic,circle orthogonal to unit circle,same ideal endpoints as Klein chord
artifacts/chapter-25-hyperbolic-geometry/figures/boundary-transformation-to-center.png,hyperbolic transformation,Mobius disk automorphism,boundary radius and distance are preserved
artifacts/chapter-25-hyperbolic-geometry/figures/angle-boundary-cross-ratio-panel.png,angle,boundary cross-ratio,equals Euclidean Poincare arc angle
artifacts/chapter-25-hyperbolic-geometry/figures/distance-cross-ratio-heatmap.png,distance,log cross-ratio,equals standard Poincare distance
