concept,representation,library,inspection_target,check
length metric,construction,matplotlib,Locate how length metric controls the unit invariant.,final-sanity.json
intrinsic distance,construction,networkx,Locate how intrinsic distance controls the unit invariant.,final-sanity.json
properness,construction,numpy,Locate how properness controls the unit invariant.,final-sanity.json
Hopf-Rinow principle,construction,matplotlib,Locate how Hopf-Rinow principle controls the unit invariant.,final-sanity.json
covering length metric,construction,networkx,Locate how covering length metric controls the unit invariant.,final-sanity.json
